<?xml version="1.0" encoding="utf-8"?>
<xs:schema xmlns:xs="http://www.w3.org/2001/XMLSchema">
  <xs:element name="owner">
    <xs:complexType>
      <xs:sequence>
        <xs:element name="id" type="xs:unsignedByte" />
        <xs:element name="name" type="xs:string" />
        <xs:element name="lastname" type="xs:string" />
        <xs:element name="specialist">
          <xs:complexType>
            <xs:sequence>
              <xs:element name="id" type="xs:unsignedByte" />
              <xs:element name="name" type="xs:string" />
              <xs:element name="lastname" type="xs:string" />
              <xs:element name="specialization" type="xs:string" />
            </xs:sequence>
          </xs:complexType>
        </xs:element>
        <xs:element name="animals">
          <xs:complexType>
            <xs:sequence>
              <xs:element maxOccurs="unbounded" name="animal">
                <xs:complexType>
                  <xs:sequence>
                    <xs:element name="id" type="xs:unsignedByte" />
                    <xs:element name="name" type="xs:string" />
                    <xs:element name="gender" type="xs:string" />
                    <xs:element name="type" type="xs:string" />
                  </xs:sequence>
                </xs:complexType>
              </xs:element>
            </xs:sequence>
          </xs:complexType>
        </xs:element>
      </xs:sequence>
    </xs:complexType>
  </xs:element>
</xs:schema>